{
  "eventId": "8e1d2c3b-4a5f-4e6d-9c8b-7a6f5e4d3c2b",
  "eventType": "PreguntaEnviadaARevision",
  "eventVersion": 1,
  "occurredAt": "2026-09-06T14:20:00Z",
  "source": "banco-preguntas-service",
  "data": {
    "preguntaId": "3f9a1c52-8d4e-4b0a-9c77-1f2e3d4a5b6c",
    "autorId": "a1b2c3d4-e5f6-4a7b-8c9d-0e1f2a3b4c5d",
    "competenciaCodigo": "ING-SOFT"
  }
}
